,question,answer,passage,type,topik
86,"""Apa arti dari relief yang terdapat pada candi Borobudur?""","""1. Kamadhatu (tingkat dasar) - melambangkan dunia kemelekatan nafsu rendah makhluk hidup. Relief bercerita kehidupan manusia penuh nafsu.
2. Rupadhatu (tingkat tengah) - melambangkan dunia manusiawi dimana manusia mulai melepaskan diri dari nafsu rendah. Relief bercerita ajaran dan kisah jataka Buddha.
3. Arupadhatu (tingkat atas) - melambangkan dunia paling tinggi, alam para dewata dan pencerahan. Relief tentang sifat Buddha, jalan menuju nirvana.
4. Stupa utama - melambangkan inti kehidupan yaitu pencerahan sempurna (bodhi) yang dicapai Buddha Gautama di bawah pohon Bodhi.""","""Relief pada Candi Borobudur memiliki makna simbolis dan cerita yang mencerminkan ajaran Buddha serta kosmologi Buddha yang dibagi menjadi 3 tingkatan ditamabah dengan 1 stupa utama, berikut makna pada setiap tingkatan:
1. Kamadhatu (tingkat dasar) - melambangkan dunia kemelekatan nafsu rendah makhluk hidup. Relief bercerita kehidupan manusia penuh nafsu.
2. Rupadhatu (tingkat tengah) - melambangkan dunia manusiawi dimana manusia mulai melepaskan diri dari nafsu rendah. Relief bercerita ajaran dan kisah jataka Buddha.
3. Arupadhatu (tingkat atas) - melambangkan dunia paling tinggi, alam para dewata dan pencerahan. Relief tentang sifat Buddha, jalan menuju nirvana.
4. Stupa utama - melambangkan inti kehidupan yaitu pencerahan sempurna (bodhi) yang dicapai Buddha Gautama di bawah pohon Bodhi.",list,Budaya
87,"""Apa yang dapat dipahami dari pola-pola yang terdapat di lantai teras Candi Borobudur sebagai representasi kebijaksanaan Buddha?""","""Pola-pola tersebut mungkin mencerminkan konsep-konsep kosmologis, filosofis, dan simbolis yang terkait dengan kebijaksanaan dan ajaran Buddha. Dalam konteks ini, pola-pola tersebut mungkin menggambarkan simbolisme yang terkait dengan konsep kosmos, alam semesta, dan perjalanan spiritual menuju pencerahan. Pola-pola tersebut juga mungkin mengandung makna simbolis yang terkait dengan konsep keseimbangan, harmoni, dan pemahaman mendalam tentang realitas dan kebijaksanaan spiritual.""","""Pola-pola yang terdapat di lantai teras Candi Borobudur dapat dipahami sebagai representasi kebijaksanaan Buddha melalui simbolisme dan makna filosofis yang terkait dengan ajaran dan praktik spiritual dalam Buddhisme. Pola-pola tersebut mungkin mencerminkan konsep-konsep kosmologis, filosofis, dan simbolis yang terkait dengan kebijaksanaan dan ajaran Buddha. Dalam konteks ini, pola-pola tersebut mungkin menggambarkan simbolisme yang terkait dengan konsep kosmos, alam semesta, dan perjalanan spiritual menuju pencerahan. Pola-pola tersebut juga mungkin mengandung makna simbolis yang terkait dengan konsep keseimbangan, harmoni, dan pemahaman mendalam tentang realitas dan kebijaksanaan spiritual.""",single,Budaya
88,"""Bagaimana peran Public Relations dalam meningkatkan citra Taman Wisata Candi Borobudur?""","""melalui kegiatan internal dan eksternal yang menciptakan hubungan baik dengan karyawan, pelanggan, komunitas, dan media. ""","""Peran Public Relations dalam meningkatkan citra Taman Wisata Candi Borobudur adalah melalui kegiatan internal dan eksternal yang menciptakan hubungan baik dengan karyawan, pelanggan, komunitas, dan media. Hal ini mempengaruhi persepsi pengunjung terhadap citra TWC Borobudur, menciptakan pandangan positif dari masyarakat, dan memberikan dampak sosial dan ekonomi yang baik bagi warga sekitar.""",single,Budaya
89,"""Bagaimana pengaruh Candi Borobudur dalam menginspirasi seniman dan budayawan di Indonesia?""","""Sebagai salah satu monumen Budha terbesar di Indonesia, Candi Borobudur menjadi sumber inspirasi bagi seniman dalam menciptakan karya seni yang menggambarkan nilai-nilai budaya dan sejarah.""","""Candi Borobudur memiliki pengaruh yang besar dalam menginspirasi seniman dan budayawan di Indonesia. Sebagai salah satu monumen Budha terbesar di Indonesia, Candi Borobudur menjadi sumber inspirasi bagi seniman dalam menciptakan karya seni yang menggambarkan nilai-nilai budaya dan sejarah. Selain itu, keberadaan Candi Borobudur juga memberikan inspirasi bagi budayawan dalam menggali dan mempelajari nilai-nilai budaya serta sejarah yang terkandung di dalamnya. Dengan demikian, Candi Borobudur tidak hanya menjadi objek pariwisata, tetapi juga menjadi sumber inspirasi yang memengaruhi perkembangan seni dan budaya di Indonesia.""",single,Budaya
90,"""Bagaimana Candi Borobudur diwariskan dari generasi ke generasi?""","""Candi Borobudur diwariskan dari generasi ke generasi melalui berbagai upaya pelestarian dan perlindungan warisan budaya.""","""Candi Borobudur diwariskan dari generasi ke generasi melalui berbagai upaya pelestarian dan perlindungan warisan budaya. Hal ini melibatkan peran serta masyarakat lokal, pemerintah, lembaga konservasi, dan organisasi internasional seperti UNESCO. Upaya pelestarian meliputi pemugaran, pengawasan, pendidikan, dan promosi untuk memastikan bahwa nilai budaya dan sejarah Candi Borobudur dapat dilestarikan dan diwariskan kepada generasi mendatang. Dengan demikian, Candi Borobudur dijaga agar tetap menjadi milik seluruh umat manusia dan menjadi tanggung jawab bersama dalam pelestariannya.""",single,Budaya
91,"""Bagaimana Candi Borobudur menarik wisatawan?""","""Candi Borobudur menarik wisatawan karena signifikansi budayanya yang unik dan kehadiran lingkungan lokal yang berbeda, menawarkan pengalaman budaya yang kaya.""","""Candi Borobudur menarik wisatawan karena signifikansi budayanya yang unik dan kehadiran lingkungan lokal yang berbeda, menawarkan pengalaman budaya yang kaya. Kuil ini terkenal sebagai situs warisan budaya dan tujuan populer untuk wisata budaya, menarik pengunjung yang tertarik untuk menjelajahi aspek sejarah dan arsitektur candi. Lokasi candi di distrik Magelang di Jawa Tengah, Indonesia, berkontribusi pada daya tariknya sebagai objek wisata, karena mudah diakses oleh wisatawan domestik dan internasional. Reputasi candi sebagai Situs Warisan Dunia UNESCO semakin meningkatkan daya tariknya, karena diakui secara global karena signifikansi sejarah dan budayanya. Kehadiran kegiatan komersial dan jasa di daerah tersebut, seperti hotel, jasa perdagangan, dan museum, juga mendukung industri pariwisata di sekitar Candi Borobudur, memberikan kemudahan dan fasilitas bagi pengunjung.""",single,Budaya
92,"""Bagaimana Candi Borobudur mencerminkan konsep keindahan pada masa itu?""","""Candi Borobudur mencerminkan konsep keindahan pada masa itu melalui arsitektur dan ukiran yang menggambarkan keagungan dan keindahan alam semesta.""","""Candi Borobudur mencerminkan konsep keindahan pada masa itu melalui arsitektur dan ukiran yang menggambarkan keagungan dan keindahan alam semesta. Struktur candi yang megah dengan relief-relief yang menggambarkan cerita-cerita Budha, serta ornamen-ornamen yang rumit, mencerminkan keindahan dan keagungan dalam konsep kehidupan dan alam semesta pada masa itu. Selain itu, keindahan Candi Borobudur juga tercermin melalui simetri dan proporsi yang terdapat dalam struktur bangunan candi tersebut.""",single,Budaya
93,"""Mengapa Candi Borobudur menjadi Situs Warisan Dunia UNESCO?""","""Candi Borobudur ditetapkan sebagai Situs Warisan Dunia UNESCO karena signifikansinya sebagai monumen budaya dan sejarah yang mewakili peradaban Jawa kuno pada abad VIII-IX M.""","""Candi Borobudur ditetapkan sebagai Situs Warisan Dunia UNESCO karena signifikansinya sebagai monumen budaya dan sejarah yang mewakili peradaban Jawa kuno pada abad VIII-IX M. Keindahan arsitektur candi, dengan ukiran relief yang rumit dan struktur platform bertumpuk, menampilkan puncak keahlian Jawa kuno. Relief naratif candi memberikan wawasan berharga tentang tipologi konstruksi kayu selama periode Jawa Kuno, berkontribusi pada pemahaman arsitektur Jawa kuno. Candi Borobudur berfungsi sebagai simbol warisan budaya Jawa yang kaya dan menarik wisatawan dari seluruh dunia, berkontribusi pada ekonomi lokal dan mempromosikan pertukaran budaya. Upaya pelestarian dan konservasi Candi Borobudur menyoroti pentingnya penjagaan warisan budaya kawasan Borobudur sebagai Situs Warisan Budaya Dunia. Secara keseluruhan, signifikansi arsitektur, nilai budaya, dan upaya pelestarian Candi Borobudur telah menyebabkan pengakuannya sebagai Situs Warisan Dunia UNESCO.""",single,Budaya
94,"""Bagaimana struktur arsitektur Candi Borobudur mencerminkan konsep sakralitas?""","""Struktur arsitektur Candi Borobudur mencerminkan konsep sakralitas melalui tatanan yang terstruktur yang mengatur relasi antar komponen-komponen dalam mewujudkan arsitektur candi yang memiliki nilai seni dan spiritual tinggi. Candi Borobudur dipermukaan membentuk mandala, dengan tingkatan di atasnya membentuk persegi empat, teras-teras berbentuk bundar, dan tingkat paling atas terdapat stupa besar. Penataan yang terstruktur ini memiliki makna simbolis yang tinggi sebagai lambang kehidupan manusia dan kehidupan setelah kematian. Dengan demikian, struktur arsitektur Candi Borobudur mencerminkan konsep sakralitas melalui tatanan yang teratur dan simbolisme yang mendalam.""","""Struktur arsitektur Candi Borobudur mencerminkan konsep sakralitas melalui tatanan yang terstruktur yang mengatur relasi antar komponen-komponen dalam mewujudkan arsitektur candi yang memiliki nilai seni dan spiritual tinggi. Candi Borobudur dipermukaan membentuk mandala, dengan tingkatan di atasnya membentuk persegi empat, teras-teras berbentuk bundar, dan tingkat paling atas terdapat stupa besar. Penataan yang terstruktur ini memiliki makna simbolis yang tinggi sebagai lambang kehidupan manusia dan kehidupan setelah kematian. Dengan demikian, struktur arsitektur Candi Borobudur mencerminkan konsep sakralitas melalui tatanan yang teratur dan simbolisme yang mendalam.""",single,Budaya
95,"""Apa peran mitos dan cerita-cerita dalam menciptakan struktur sakral Candi Borobudur?""","""Peran mitos dan cerita-cerita dalam menciptakan struktur sakral Candi Borobudur terletak pada pengaruhnya terhadap simbolisme dan makna yang terkandung dalam struktur fisik candi. Mitos dan cerita-cerita yang terkait dengan kepercayaan dan ajaran agama Buddha menjadi landasan dalam pembangunan struktur candi, serta memberikan arahan dalam penataan simbol-simbol dan elemen-elemen arsitektural yang menggambarkan konsep kosmologi Buddha. Dengan demikian, mitos dan cerita-cerita memainkan peran penting dalam menciptakan struktur sakral Candi Borobudur dengan menginspirasi simbolisme, tatanan, dan makna yang terkandung dalam setiap elemen arsitektural candi.""","""Peran mitos dan cerita-cerita dalam menciptakan struktur sakral Candi Borobudur terletak pada pengaruhnya terhadap simbolisme dan makna yang terkandung dalam struktur fisik candi. Mitos dan cerita-cerita yang terkait dengan kepercayaan dan ajaran agama Buddha menjadi landasan dalam pembangunan struktur candi, serta memberikan arahan dalam penataan simbol-simbol dan elemen-elemen arsitektural yang menggambarkan konsep kosmologi Buddha. Dengan demikian, mitos dan cerita-cerita memainkan peran penting dalam menciptakan struktur sakral Candi Borobudur dengan menginspirasi simbolisme, tatanan, dan makna yang terkandung dalam setiap elemen arsitektural candi.""",single,Budaya
96,"""Apa pentingnya pose meditasi yang digambarkan dalam patung-patung di Candi Borobudur?""","""Pose meditasi, seperti dhyana mudra, sangat penting dalam agama Buddha karena melambangkan konsentrasi yang dalam dan kedamaian batin.""","""Pose meditasi, seperti dhyana mudra, sangat penting dalam agama Buddha karena melambangkan konsentrasi yang dalam dan kedamaian batin. Pose-pose ini diyakini memfasilitasi praktik meditasi, yang merupakan aspek mendasar dari ajaran Buddha. Mudra dhyana, dengan kaki bersilang dan tangan bertumpu di pangkuan, mewakili keadaan ketenangan dan perhatian penuh yang ingin dicapai oleh praktisi selama meditasi. Dengan mengasumsikan pose ini, individu dapat menumbuhkan keadaan pikiran yang terfokus dan tenang, memungkinkan mereka untuk mengeksplorasi diri batin mereka dan mencapai wawasan spiritual. Pose meditasi yang digambarkan dalam patung-patung di Candi Borobudur berfungsi sebagai pengingat visual tentang pentingnya meditasi dalam jalan Buddhis menuju pencerahan. Praktisi dan pengunjung kuil dapat mengambil inspirasi dari pose-pose ini untuk memperdalam latihan meditasi mereka sendiri dan menumbuhkan kedamaian batin dan kebijaksanaan.""",single,Budaya
97,"""Apa peran strukturalisme dalam memahami dimensi sakral Candi Borobudur?""","""Dengan menggunakan analisis struktural, kita dapat melihat bagaimana komponen-komponen dalam arsitektur candi membentuk sistem tanda sakral yang memungkinkan untuk merekonstruksi pengetahuan dan gagasan masyarakat pada masa itu dalam mewujudkan bangunan sakral candi untuk ritual keagamaan.""","""Peran strukturalisme dalam memahami dimensi sakral Candi Borobudur adalah untuk mengungkap makna dan logika di balik simbol-simbol dan struktur bangunan candi tersebut. Dengan menggunakan analisis struktural, kita dapat melihat bagaimana komponen-komponen dalam arsitektur candi membentuk sistem tanda sakral yang memungkinkan untuk merekonstruksi pengetahuan dan gagasan masyarakat pada masa itu dalam mewujudkan bangunan sakral candi untuk ritual keagamaan. Dengan demikian, strukturalisme membantu dalam memahami bagaimana Candi Borobudur memiliki dimensi sakral yang penting dalam konteks keagamaan.""",single,Budaya
98,"""Bagaimana elemen-elemen lantai teras Candi Borobudur mencerminkan konsep nirwana dalam Buddhisme?""","""Elemen-elemen lantai teras Candi Borobudur mencerminkan konsep nirwana dalam Buddhisme melalui simbolisme yang terkait dengan tahapan perjalanan spiritual menuju pencerahan dan pembebasan dari siklus kelahiran dan kematian (samsara).""","""Elemen-elemen lantai teras Candi Borobudur mencerminkan konsep nirwana dalam Buddhisme melalui simbolisme yang terkait dengan tahapan perjalanan spiritual menuju pencerahan dan pembebasan dari siklus kelahiran dan kematian (samsara). Dalam ajaran Buddha, nirwana merupakan pencapaian tertinggi yang menggambarkan keadaan bebas dari penderitaan dan kesadaran yang terbebas dari ikatan duniawi.
Dalam konteks lantai teras Candi Borobudur, elemen-elemen seperti relief-relief, simbol-simbol geometris, dan representasi binatang dapat diinterpretasikan sebagai simbol dari perjalanan spiritual menuju nirwana. Tahapan perjalanan spiritual yang terwakili dalam lantai teras mencerminkan konsep pencapaian Bodhisattvabhumi yang merupakan langkah-langkah menuju pembebasan akhir.
Selain itu, elemen-elemen lantai teras yang mencapai puncak candi, seperti stupa raksasa, juga dapat diartikan sebagai simbol dari pencapaian tertinggi menuju nirwana. Dengan demikian, lantai teras Candi Borobudur secara keseluruhan mencerminkan konsep perjalanan spiritual yang menuju pembebasan dan pencapaian nirwana dalam ajaran Buddha.""",single,Budaya
99,"""Apa peran riset pasar dalam membantu Public Relations memahami preferensi dan ekspektasi masyarakat terhadap Taman Wisata Candi Borobudur?""","""Peran riset pasar dalam membantu Public Relations memahami preferensi dan ekspektasi masyarakat terhadap Taman Wisata Candi Borobudur sangat penting. Melalui riset pasar, Public Relations dapat memperoleh pemahaman mendalam tentang preferensi, harapan, dan kebutuhan pengunjung potensial maupun pengunjung yang sudah ada terhadap pengalaman di Taman Wisata Candi Borobudur. Hal ini memungkinkan mereka untuk: 1. Mengidentifikasi Preferensi Pengunjung: Memahami apa yang dicari oleh pengunjung, seperti jenis pengalaman wisata, fasilitas yang diharapkan, dan kebutuhan mereka selama berkunjung, 2. Menyesuaikan Strategi Komunikasi: Menggunakan wawasan dari riset pasar untuk menyesuaikan pesan dan strategi komunikasi agar lebih sesuai dengan preferensi dan ekspektasi masyarakat, 3. Mengembangkan Program dan Layanan: Merancang program dan layanan yang lebih sesuai dengan keinginan pengunjung, sehingga dapat meningkatkan kepuasan dan pengalaman positif mereka di Taman Wisata Candi Borobudur. Dengan demikian, riset pasar membantu Public Relations untuk lebih efektif dalam memahami dan merespons preferensi serta ekspektasi masyarakat terhadap Taman Wisata Candi Borobudur, sehingga dapat meningkatkan citra dan pengalaman pengunjung secara keseluruhan.""","""Peran riset pasar dalam membantu Public Relations memahami preferensi dan ekspektasi masyarakat terhadap Taman Wisata Candi Borobudur sangat penting. Melalui riset pasar, Public Relations dapat memperoleh pemahaman mendalam tentang preferensi, harapan, dan kebutuhan pengunjung potensial maupun pengunjung yang sudah ada terhadap pengalaman di Taman Wisata Candi Borobudur. Hal ini memungkinkan mereka untuk: 1. Mengidentifikasi Preferensi Pengunjung: Memahami apa yang dicari oleh pengunjung, seperti jenis pengalaman wisata, fasilitas yang diharapkan, dan kebutuhan mereka selama berkunjung, 2. Menyesuaikan Strategi Komunikasi: Menggunakan wawasan dari riset pasar untuk menyesuaikan pesan dan strategi komunikasi agar lebih sesuai dengan preferensi dan ekspektasi masyarakat, 3. Mengembangkan Program dan Layanan: Merancang program dan layanan yang lebih sesuai dengan keinginan pengunjung, sehingga dapat meningkatkan kepuasan dan pengalaman positif mereka di Taman Wisata Candi Borobudur. Dengan demikian, riset pasar membantu Public Relations untuk lebih efektif dalam memahami dan merespons preferensi serta ekspektasi masyarakat terhadap Taman Wisata Candi Borobudur, sehingga dapat meningkatkan citra dan pengalaman pengunjung secara keseluruhan.""",list,Budaya
100,"""Mengapa Stupa di Candi Borobudur memiliki bentuk tertentu?""","""Bentuk Stupa di Candi Borobudur dipengaruhi oleh arsitektur tradisional India dan simbolisme Buddha. Beberapa tingkatan Stupa melambangkan alam eksistensi yang berbeda dalam kosmologi Buddhis, dengan tingkat atas mewakili ranah pencerahan. Bentuk spesifik Stupa di Candi Borobudur adalah hasil perpaduan tradisi arsitektur India dan simbolisme Buddha, menciptakan struktur yang unik dan bermakna.""","""Bentuk Stupa di Candi Borobudur dipengaruhi oleh arsitektur tradisional India dan simbolisme Buddha. Stupa dirancang untuk mewakili gunung kosmik, Gunung Meru, yang dianggap suci dalam kosmologi Buddha. Bentuk Stupa ditandai dengan kubah berbentuk lonceng, yang melambangkan dunia keinginan, dan dasar persegi, mewakili alam duniawi. Beberapa tingkatan Stupa melambangkan alam eksistensi yang berbeda dalam kosmologi Buddhis, dengan tingkat atas mewakili ranah pencerahan. Ukiran dan dekorasi rumit di permukaan Stupa menggambarkan berbagai ajaran dan cerita Buddha, menambah makna simbolisnya. Bentuk spesifik Stupa di Candi Borobudur adalah hasil perpaduan tradisi arsitektur India dan simbolisme Buddha, menciptakan struktur yang unik dan bermakna.""",single,Pemugaran
101,"""Bagaimana peran Public Relations dalam meningkatkan citra Taman Wisata Candi Borobudur?""","""Peran Public Relations dalam meningkatkan citra Taman Wisata Candi Borobudur adalah melalui kegiatan internal dan eksternal yang menciptakan hubungan baik dengan karyawan, pelanggan, komunitas, dan media.""","""Peran Public Relations dalam meningkatkan citra Taman Wisata Candi Borobudur adalah melalui kegiatan internal dan eksternal yang menciptakan hubungan baik dengan karyawan, pelanggan, komunitas, dan media. Hal ini mempengaruhi persepsi pengunjung terhadap citra TWC Borobudur, menciptakan pandangan positif dari masyarakat, dan memberikan dampak sosial dan ekonomi yang baik bagi warga sekitar.""",single,Pemugaran
102,"""Apa tantangan utama dalam pemugaran Candi Borobudur?""","""Tantangan utama dalam pemugaran Candi Borobudur meliputi pemulihan kerusakan akibat pengabaian, kerusakan alam seperti letusan gunung berapi dan gempa bumi, serta perlindungan dari kerusakan akibat air hujan.""","""Tantangan utama dalam pemugaran Candi Borobudur meliputi pemulihan kerusakan akibat pengabaian, kerusakan alam seperti letusan gunung berapi dan gempa bumi, serta perlindungan dari kerusakan akibat air hujan. Selain itu, tantangan lainnya termasuk pemulihan arca, relief, dan struktur candi yang memprihatinkan setelah beberapa waktu ditinggalkan.""",single,Pemugaran
103,"""Apakah ada program edukasi khusus untuk meningkatkan pengetahuan masyarakat tentang sejarah Candi Borobudur?""","""Ya, ada program edukasi khusus yang bertujuan untuk meningkatkan pengetahuan masyarakat tentang sejarah Candi Borobudur. Beberapa program tersebut meliputi:
1. Tur Pendidikan
2. Pameran dan Workshop
3. Program Pendidikan Sekolah
4. Media Sosial dan Konten Digital
5. Program Pelatihan.""","""Ada program edukasi khusus yang bertujuan untuk meningkatkan pengetahuan masyarakat tentang sejarah Candi Borobudur. Beberapa program tersebut meliputi:
1. Tur Pendidikan: Program tur pendidikan yang diselenggarakan oleh pihak terkait, seperti Balai Konservasi Borobudur, untuk memberikan pengetahuan langsung kepada masyarakat tentang sejarah, arsitektur, dan makna simbolis Candi Borobudur.
2. Pameran dan Workshop: Penyelenggaraan pameran dan workshop tentang Candi Borobudur yang melibatkan masyarakat lokal, pelajar, dan pengunjung untuk memperdalam pemahaman mereka tentang sejarah dan kebudayaan candi.
3. Program Pendidikan Sekolah: Integrasi materi tentang Candi Borobudur ke dalam kurikulum sekolah, serta penyelenggaraan kunjungan edukasi ke Candi Borobudur untuk siswa dan guru.
4. Media Sosial dan Konten Digital: Penggunaan media sosial dan konten digital untuk menyebarkan informasi tentang sejarah Candi Borobudur kepada masyarakat luas, terutama generasi muda.
5. Program Pelatihan: Program pelatihan untuk pemandu wisata, pemandu lokal, dan relawan yang bertujuan untuk meningkatkan pemahaman mereka tentang sejarah dan kebudayaan Candi Borobudur.
Melalui program-program ini, diharapkan pengetahuan masyarakat tentang sejarah Candi Borobudur dapat ditingkatkan, sehingga masyarakat dapat lebih menghargai dan memahami nilai warisan budaya yang dimiliki oleh Candi Borobudur.""",list,Pemugaran
104,"""Apa dampak pemugaran pertama terhadap keberlanjutan Candi Borobudur?""","""Pemugaran pertama Candi Borobudur yang dilakukan pada masa pemerintahan Sir Thomas Stamford Raffles memiliki dampak yang signifikan terhadap keberlanjutan candi. Upaya pemugaran tersebut berhasil memulihkan keagungan bangunan candi yang memprihatinkan, sehingga memungkinkan Candi Borobudur tetap dapat dinikmati dan dipelajari oleh generasi selanjutnya.""","""Pemugaran pertama Candi Borobudur yang dilakukan pada masa pemerintahan Sir Thomas Stamford Raffles memiliki dampak yang signifikan terhadap keberlanjutan candi. Upaya pemugaran tersebut berhasil memulihkan keagungan bangunan candi yang memprihatinkan, sehingga memungkinkan Candi Borobudur tetap dapat dinikmati dan dipelajari oleh generasi selanjutnya. Dengan pemugaran tersebut, Candi Borobudur dapat terus menjadi salah satu situs berharga warisan peradaban nusantara yang dilestarikan hingga saat ini.""",single,Pemugaran
105,"""Bagaimana Stupa di Candi Borobudur menggambarkan cerita kehidupan Buddha?""","""1. Stupa di Candi Borobudur sebagai Simbol Parinirvana
Melambangkan Parinirvana, tahap kebebasan tertinggi yang dicapai oleh Buddha. 
2. Sikap Tangan pada Arca Stupa
Sikap tangan ini disebut mudra dharmacakra, yang melambangkan pemerintahan Buddha atas dunia.
3. Stupa sebagai Tempat Suci
Stupa merupakan tempat suci yang digunakan untuk menyimpan abu Sang Buddha.""","""1. Stupa di Candi Borobudur sebagai Simbol Parinirvana
Stupa-stupa yang terdapat di Candi Borobudur melambangkan Parinirvana, tahap kebebasan tertinggi yang dicapai oleh Buddha. Stupa-stupa ini melambangkan perjalanan para yogin yang berusaha mencapai tingkat Kebuddhaan. Stupa-stupa bercelah pada teras lingkar candi menunjukkan perjalanan spiritual yang dilalui oleh para yogin. Selain itu, stupa-stupa lainnya pada pagar langkan candi dan teras lingkar puncak candi juga menyimbolkan konsep Parinirvana. Stupa juga merupakan bentuk mandala yang melambangkan roda kosmos dan mewakili dharma Buddha, kesatuan, harmoni, dan keseimbangan.
2. Sikap Tangan pada Arca Stupa
Arca-arca Tathagatha yang terdapat di dalam stupa-stupa bercelah digambarkan dengan sikap tangan sedang mengajarkan dharma. Sikap tangan ini disebut mudra dharmacakra, yang melambangkan pemerintahan Buddha atas dunia. Stupa-stupa di Candi Borobudur juga merupakan bagian dari sistem perlambangan seorang yogin dalam menjalani tahap-tahap pengalaman yang dilalui oleh Sang Buddha.
3. Stupa sebagai Tempat Suci
Stupa merupakan tempat suci yang digunakan untuk menyimpan abu Sang Buddha. Candi Borobudur diduga merupakan sebuah stupa besar yang terdiri dari banyak stupa kecil. Stupa-stupa ini menjadi identitas penting yang menandakan bangunan suci beragama Buddha. Selain itu, stupa juga memiliki arti dan maksud dalam penerapannya sebagai bagian dari arsitektur candi Buddha.""",single,Pemugaran
106,"""Bagaimana metode pemugaran Candi Borobudur yang digunakan pada saat itu?""","""Upaya pemugaran dilakukan untuk memperbaiki kerusakan yang terjadi pada arca, relief, dan struktur candi akibat pengabaian dan kerusakan alam. Metode yang digunakan melibatkan pemulihan dan perbaikan secara hati-hati untuk memastikan keaslian dan keutuhan bangunan candi.""","""Pada saat itu, metode pemugaran Candi Borobudur melibatkan serangkaian konservasi dan usaha untuk memulihkan keagungan bangunan candi. Upaya pemugaran dilakukan untuk memperbaiki kerusakan yang terjadi pada arca, relief, dan struktur candi akibat pengabaian dan kerusakan alam. Metode yang digunakan melibatkan pemulihan dan perbaikan secara hati-hati untuk memastikan keaslian dan keutuhan bangunan candi.""",single,Pemugaran
