,question,answer,passage,type,topik
46,"""Bagaimana Stupa di Candi Borobudur terkait dengan konsep perjalanan spiritual?""","""Stupa mewakili tujuan akhir dari perjalanan spiritual ini, melambangkan pencerahan dan pencapaian Nirvana. Saat pengunjung mengelilingi Stupa, mereka terlibat dalam bentuk perjalanan spiritual, bergerak dari alam luar keberadaan menuju pusat, yang mewakili keadaan kesadaran tertinggi. Ukiran dan relief di Stupa menggambarkan berbagai ajaran dan cerita Buddha, berfungsi sebagai panduan visual untuk kontemplasi spiritual selama perjalanan.Tindakan berjalan di sekitar Stupa dan mengamati ukiran dapat dilihat sebagai bentuk meditasi dan refleksi diri, memfasilitasi pertumbuhan dan pemahaman spiritual.""","""Stupa di Candi Borobudur terkait erat dengan konsep perjalanan spiritual. Kuil itu sendiri dirancang sebagai situs ziarah, dengan jalan setapak yang menuntun pengunjung dalam perjalanan pendakian spiritual. Stupa mewakili tujuan akhir dari perjalanan spiritual ini, melambangkan pencerahan dan pencapaian Nirvana. Saat pengunjung mengelilingi Stupa, mereka terlibat dalam bentuk perjalanan spiritual, bergerak dari alam luar keberadaan menuju pusat, yang mewakili keadaan kesadaran tertinggi. Ukiran dan relief di Stupa menggambarkan berbagai ajaran dan cerita Buddha, berfungsi sebagai panduan visual untuk kontemplasi spiritual selama perjalanan.Tindakan berjalan di sekitar Stupa dan mengamati ukiran dapat dilihat sebagai bentuk meditasi dan refleksi diri, memfasilitasi pertumbuhan dan pemahaman spiritual.""",single,Arsitektur
47,"""Apa kesamaan konstruksi kayu pada relief Candi Borobudur dengan arsitektur tradisional Indonesia?""","""Bentuk Atap Serupa, Teknik Konstruksi, Signifikansi Budaya, Tujuan Fungsional, Inspirasi untuk Desain, Elemen Estetika Bersama""","""Bentuk Atap Serupa: Konstruksi kayu yang digambarkan pada relief Candi Borobudur memiliki kemiripan dengan arsitektur tradisional Indonesia dalam hal bentuk atap, seperti atap miring keluar (miring keluar) dan atap limasan.
Teknik Konstruksi: Konstruksi kayu pada relief, termasuk rumah dan bangunan, berbagi teknik konstruksi dengan arsitektur tradisional Indonesia, seperti penggunaan bahan kayu dan metode tukang kayu tertentu.
Signifikansi Budaya: Baik konstruksi kayu pada relief maupun arsitektur tradisional Indonesia memiliki signifikansi budaya dalam konteks masing-masing, mewakili warisan arsitektur wilayah dan mencerminkan gaya hidup dan tradisi masyarakat setempat.
Tujuan Fungsional: Konstruksi kayu pada relief, yang meliputi rumah, lumbung, aula, dan biara, melayani tujuan fungsional yang sama dengan arsitektur tradisional Indonesia, menyediakan tempat berlindung, penyimpanan, dan ruang komunal.
Inspirasi untuk Desain: Konstruksi kayu yang digambarkan pada relief dapat menjadi inspirasi bagi arsitek kontemporer dalam desain bangunan, khususnya dalam pelestarian dan restorasi situs warisan budaya seperti Candi Borobudur.
Elemen Estetika Bersama: Baik konstruksi kayu pada relief maupun arsitektur tradisional Indonesia menunjukkan elemen estetika yang sama, seperti penggunaan ukiran rumit dan motif dekoratif, yang menampilkan keahlian artistik wilayah tersebut.""",single,Arsitektur
48,"""Bagaimana atap kayu pada Candi Borobudur menggambarkan keterampilan konstruksi pada masa itu?""","""Atap kayu pada Candi Borobudur menggambarkan keterampilan konstruksi pada masa itu melalui relief yang menggambarkan bangunan berkonstruksi kayu dengan atap pelana yang miring keluar, atap limasan, dan atap limasan dengan tambahan kanopi.""","""Atap kayu pada Candi Borobudur menggambarkan keterampilan konstruksi pada masa itu melalui relief yang menggambarkan bangunan berkonstruksi kayu dengan atap pelana yang miring keluar, atap limasan, dan atap limasan dengan tambahan kanopi. Bangunan-bangunan ini juga menunjukkan konstruksi kaki dan lantai yang menunjukkan kemahiran dalam penggunaan material kayu dan teknik konstruksi pada masa itu.""",single,Arsitektur
49,"""Apa yang dapat kita pelajari dari teknik konstruksi atap kayu pada Candi Borobudur untuk aplikasi modern?""","""Dari teknik konstruksi atap kayu pada Candi Borobudur, kita dapat mempelajari kemahiran dalam penggunaan material kayu dan teknik konstruksi pada masa itu. Hal ini dapat memberikan inspirasi untuk pengembangan teknik konstruksi modern yang memanfaatkan keunggulan material kayu dalam keberlanjutan dan keindahan arsitektur.""","""Dari teknik konstruksi atap kayu pada Candi Borobudur, kita dapat mempelajari kemahiran dalam penggunaan material kayu dan teknik konstruksi pada masa itu. Hal ini dapat memberikan inspirasi untuk pengembangan teknik konstruksi modern yang memanfaatkan keunggulan material kayu dalam keberlanjutan dan keindahan arsitektur. Selain itu, pemahaman tentang tipologi atap kayu pada Candi Borobudur juga dapat memberikan wawasan bagi perancangan arsitektur bangunan pada masa sekarang dengan memadukan nilai-nilai tradisional dan kebutuhan kontemporer.""",single,Arsitektur
50,"""Bagaimana lantai teras Candi Borobudur mencerminkan konsep kesempurnaan dalam ajaran Buddha?""","""Lantai teras ini menggambarkan tahapan-tahapan pencapaian Bodhisattvabhumi, yang merupakan tingkatan kesempurnaan dalam ajaran Buddha""","""Lantai teras Candi Borobudur mencerminkan konsep kesempurnaan dalam ajaran Buddha melalui representasi tahapan perjalanan spiritual menuju pencerahan. Setiap lantai teras memiliki makna filosofis yang terkait dengan tahapan perjalanan spiritual dalam ajaran Buddha, yang menggambarkan perjalanan menuju kesempurnaan. Lantai teras ini menggambarkan tahapan-tahapan pencapaian Bodhisattvabhumi, yang merupakan tingkatan kesempurnaan dalam ajaran Buddha. Dengan demikian, pengaturan ruang dan simbolisme di lantai teras Candi Borobudur mencerminkan konsep kesempurnaan dalam ajaran Buddha melalui representasi perjalanan spiritual menuju pencerahan dan pembebasan dari siklus kelahiran dan kematian.""",single,Budaya
51,"""Bagaimana tipologi atap pada relief Candi Borobudur?""","""Tipologi atap bangunan berkonstruksi kayu pada relief Candi Borobudur dapat dibedakan menjadi tujuh tipe/kelompok, yaitu limasan, limasan melengkung, limasan dengan tambahan kanopi, pelana, pelana miring keluar, pelana melengkung, dan atap persegi bertingkat.""","""Tipologi atap bangunan berkonstruksi kayu pada relief Candi Borobudur dapat dibedakan menjadi tujuh tipe/kelompok, yaitu limasan, limasan melengkung, limasan dengan tambahan kanopi, pelana, pelana miring keluar, pelana melengkung, dan atap persegi bertingkat. Setiap tipe atap memiliki karakteristik konstruksi yang berbeda, dan dapat ditemukan dalam relief cerita Candi Borobudur. Total terdapat 179 panil relief cerita yang memperlihatkan berbagai tipe atap tersebut.""",single,Budaya
52,"""Mengapa pola-pola simetris menjadi karakteristik utama di lantai teras Candi Borobudur?""","""Pola-pola simetris menjadi karakteristik utama di lantai teras Candi Borobudur karena mereka mencerminkan konsep keseimbangan, harmoni, dan keselarasan yang penting dalam ajaran Buddha""","""Pola-pola simetris menjadi karakteristik utama di lantai teras Candi Borobudur karena mereka mencerminkan konsep keseimbangan, harmoni, dan keselarasan yang penting dalam ajaran Buddha. Dalam konteks ajaran Buddha, konsep simetri dan keseimbangan memiliki makna simbolis yang mendalam terkait dengan pencarian pencerahan dan kesempurnaan spiritual. Pola-pola simetris yang terdapat di lantai teras Candi Borobudur dapat diartikan sebagai representasi visual dari konsep keseimbangan antara pikiran, perkataan, dan perbuatan yang merupakan bagian penting dari ajaran Buddha. Selain itu, simetri juga mencerminkan keselarasan antara manusia dan alam semesta, serta harmoni dalam pencapaian kesempurnaan spiritual.""",single,Budaya
53,"""Bagaimana hubungan antara Candi Borobudur dengan penyebaran agama Buddha di kawasan Asia Tenggara?""","""Candi Borobudur merupakan simbol Buddhisme yang signifikan di Asia Tenggara. Ini mencerminkan pengaruh agama Buddha di wilayah tersebut dan penyebarannya selama dibangun.""","""Candi Borobudur merupakan situs warisan budaya di Indonesia dan dianggap sebagai salah satu keajaiban dunia. Terdiri dari sembilan teras bertumpuk, dengan enam teras persegi dan tiga teras melingkar, mewakili kosmologi Kamadhatu, Rupadhatu, dan Arupadhatu. Candi Borobudur merupakan simbol Buddhisme yang signifikan di Asia Tenggara. Ini mencerminkan pengaruh agama Buddha di wilayah tersebut dan penyebarannya selama dibangun. Struktur dan desain candi, dengan ukiran dan reliefnya yang rumit, menggambarkan ajaran dan cerita Buddha, berfungsi sebagai representasi visual dari prinsip-prinsip Buddha. Lokasi candi di Indonesia, negara yang didominasi Muslim, menyoroti keberadaan historis dan dampak agama Buddha di wilayah tersebut. Pelestarian dan pengakuan Candi Borobudur sebagai situs Warisan Dunia UNESCO berkontribusi pada promosi dan pemahaman Buddhisme di Asia Tenggara.""",single,Budaya
54,"""Bagaimana elemen-elemen lantai teras Candi Borobudur mencerminkan konsep nirwana dalam Buddhisme?""","""Elemen-elemen lantai teras Candi Borobudur mencerminkan konsep nirwana dalam Buddhisme melalui simbolisme yang terkait dengan tahapan perjalanan spiritual menuju pencerahan dan pembebasan dari siklus kelahiran dan kematian (samsara).""","""Elemen-elemen lantai teras Candi Borobudur mencerminkan konsep nirwana dalam Buddhisme melalui simbolisme yang terkait dengan tahapan perjalanan spiritual menuju pencerahan dan pembebasan dari siklus kelahiran dan kematian (samsara). Dalam ajaran Buddha, nirwana merupakan pencapaian tertinggi yang menggambarkan keadaan bebas dari penderitaan dan kesadaran yang terbebas dari ikatan duniawi.
Dalam konteks lantai teras Candi Borobudur, elemen-elemen seperti relief-relief, simbol-simbol geometris, dan representasi binatang dapat diinterpretasikan sebagai simbol dari perjalanan spiritual menuju nirwana. Tahapan perjalanan spiritual yang terwakili dalam lantai teras mencerminkan konsep pencapaian Bodhisattvabhumi yang merupakan langkah-langkah menuju pembebasan akhir.
Selain itu, elemen-elemen lantai teras yang mencapai puncak candi, seperti stupa raksasa, juga dapat diartikan sebagai simbol dari pencapaian tertinggi menuju nirwana. Dengan demikian, lantai teras Candi Borobudur secara keseluruhan mencerminkan konsep perjalanan spiritual yang menuju pembebasan dan pencapaian nirwana dalam ajaran Buddha.""",single,Budaya
55,"""Apakah terdapat inovasi atau elemen desain unik dalam atap kayu Candi Borobudur?""","""Ya, atap kayu Candi Borobudur memiliki variasi bentuk atap yang muncul dari bentuk dasar atapnya, seperti atap limasan dengan tambahan kanopi pada bagian depan atau samping, serta atap dengan bentuk pelana. Selain itu, terdapat juga variasi penggambaran dinding bangunan pada relief Candi Borobudur, yang menunjukkan adanya inovasi dan elemen desain unik dalam konstruksi bangunan berkonstruksi kayu pada Candi Borobudur.""","""Terdapat inovasi dan elemen desain unik dalam atap kayu Candi Borobudur. Dokumen menyebutkan bahwa atap kayu Candi Borobudur memiliki variasi bentuk atap yang muncul dari bentuk dasar atapnya, seperti atap limasan dengan tambahan kanopi pada bagian depan atau samping, serta atap dengan bentuk pelana. Selain itu, terdapat juga variasi penggambaran dinding bangunan pada relief Candi Borobudur, yang menunjukkan adanya inovasi dan elemen desain unik dalam konstruksi bangunan berkonstruksi kayu pada Candi Borobudur.""",single,Budaya
56,"""Apa pesan budaya yang terdapat dalam Candi Borobudur?""","""Dari segi budaya, keberadaan Candi Borobudur menyiratkan makna bahwa etnomatematika telah berkembang pada masa itu, dimana konsep matematika digunakan untuk membangun Candi Borobudur dan menjadi budaya berupa aktivitas dalam kehidupan manusia.""","""Dari segi budaya, keberadaan Candi Borobudur menyiratkan makna bahwa etnomatematika telah berkembang pada masa itu, dimana konsep matematika digunakan untuk membangun Candi Borobudur dan menjadi budaya berupa aktivitas dalam kehidupan manusia. Selain itu, terdapat pesan bahwa Candi Borobudur sebagai wujud budaya klasik Jawa dalam bentuk struktur bangunan candi. Bahkan dunia telah menetapkan Candi Borobudur sebagai warisan dunia (World Cultural Heritage) dalam kategori budaya tahun 1990.""",single,Budaya
57,"""Apa strategi Public Relations untuk mengatasi persepsi negatif yang mungkin dimiliki oleh sebagian masyarakat terhadap Taman Wisata Candi Borobudur?""","""Untuk mengatasi persepsi negatif yang mungkin dimiliki oleh sebagian masyarakat terhadap Taman Wisata Candi Borobudur, Public Relations dapat menerapkan strategi berikut: 1. Komunikasi Terbuka: Melakukan komunikasi terbuka dan transparan dengan masyarakat untuk menyampaikan informasi yang akurat dan menjelaskan upaya perbaikan yang dilakukan, 2. Program Edukasi: Mengadakan program edukasi dan kunjungan terbuka untuk memberikan pemahaman yang lebih baik tentang sejarah, budaya, dan keindahan Taman Wisata Candi Borobudur kepada masyarakat, 3. Keterlibatan Masyarakat: Melibatkan masyarakat dalam program-program CSR dan kegiatan positif lainnya untuk memperlihatkan dampak positif yang dihasilkan oleh Taman Wisata Candi Borobudur bagi masyarakat sekitar, 4. Manajemen Krisis: Menyiapkan rencana manajemen krisis yang efektif untuk merespons dan mengatasi situasi yang dapat memengaruhi citra negatif Taman Wisata Candi Borobudur, 5. Penguatan Citra Positif: Fokus pada promosi dan kegiatan yang menunjukkan komitmen Taman Wisata Candi Borobudur dalam melestarikan warisan budaya, lingkungan, dan memberikan pengalaman positif bagi pengunjung. Dengan menerapkan strategi ini, Public Relations dapat secara proaktif mengatasi persepsi negatif dan membangun citra positif Taman Wisata Candi Borobudur di mata masyarakat.""","""Untuk mengatasi persepsi negatif yang mungkin dimiliki oleh sebagian masyarakat terhadap Taman Wisata Candi Borobudur, Public Relations dapat menerapkan strategi berikut: 1. Komunikasi Terbuka: Melakukan komunikasi terbuka dan transparan dengan masyarakat untuk menyampaikan informasi yang akurat dan menjelaskan upaya perbaikan yang dilakukan, 2. Program Edukasi: Mengadakan program edukasi dan kunjungan terbuka untuk memberikan pemahaman yang lebih baik tentang sejarah, budaya, dan keindahan Taman Wisata Candi Borobudur kepada masyarakat, 3. Keterlibatan Masyarakat: Melibatkan masyarakat dalam program-program CSR dan kegiatan positif lainnya untuk memperlihatkan dampak positif yang dihasilkan oleh Taman Wisata Candi Borobudur bagi masyarakat sekitar, 4. Manajemen Krisis: Menyiapkan rencana manajemen krisis yang efektif untuk merespons dan mengatasi situasi yang dapat memengaruhi citra negatif Taman Wisata Candi Borobudur, 5. Penguatan Citra Positif: Fokus pada promosi dan kegiatan yang menunjukkan komitmen Taman Wisata Candi Borobudur dalam melestarikan warisan budaya, lingkungan, dan memberikan pengalaman positif bagi pengunjung. Dengan menerapkan strategi ini, Public Relations dapat secara proaktif mengatasi persepsi negatif dan membangun citra positif Taman Wisata Candi Borobudur di mata masyarakat.""",list,Budaya
58,"""Apa arti budaya unik dari Candi Borobudur?""","""Budaya unik Candi Borobudur mengacu pada warisan budaya dan tradisi yang berbeda yang terkait dengan candi dan lingkungan sekitarnya."" ","""Budaya unik Candi Borobudur mengacu pada warisan budaya dan tradisi yang berbeda yang terkait dengan candi dan lingkungan sekitarnya. Kuil ini dikenal karena signifikansi historis dan arsitekturnya, menampilkan warisan budaya yang kaya di wilayah tersebut. Pengunjung tertarik ke Candi Borobudur karena kesempatan untuk mengalami budaya lokal, termasuk ritual tradisional, adat istiadat, dan praktik. Kehadiran lingkungan lokal yang semarak di sekitar kuil menambah pengalaman budaya yang unik, dengan komunitas lokal melestarikan dan menampilkan tradisi dan cara hidup mereka. Keunikan budaya Candi Borobudur berkontribusi pada daya tariknya sebagai tujuan wisata budaya, menarik wisatawan domestik dan internasional yang tertarik untuk menjelajahi dan membenamkan diri dalam budaya lokal.""",single,Budaya
59,"""Bagaimana Candi Borobudur mencerminkan nilai-nilai kearifan lokal masyarakat sekitarnya?""","""Masyarakat sekitar candi membuat berbagai jenis kerajinan seperti gantungan kunci, gelang, dan pulpen dengan tujuan untuk meningkatkan nilai perekonomian mereka serta memperkenalkan nilai budaya yang mereka buat dari hasil tangan mereka sendiri.""","""Candi Borobudur mencerminkan nilai-nilai kearifan lokal masyarakat sekitarnya melalui pemanfaatan nilai budaya yang dihasilkan oleh masyarakat sekitar candi. Misalnya, masyarakat sekitar candi membuat berbagai jenis kerajinan seperti gantungan kunci, gelang, dan pulpen dengan tujuan untuk meningkatkan nilai perekonomian mereka serta memperkenalkan nilai budaya yang mereka buat dari hasil tangan mereka sendiri. Selain itu, masyarakat sekitar candi juga memanfaatkan rumah-rumah mereka sebagai tempat penginapan bagi para pengunjung yang datang ke Candi Borobudur, sehingga nilai budaya yang dimiliki oleh masyarakat tersebut dapat dilestarikan. Dengan demikian, pemanfaatan nilai budaya Candi Borobudur mencerminkan kearifan lokal masyarakat sekitarnya dalam upaya pelestarian warisan budaya dan peningkatan ekonomi lokal.""",single,Budaya
60,"""Apakah karakteristik fisik batu yang membentuk relief-relief di Candi Borobudur?""","""Karakteristik fisik batu yang membentuk relief-relief di Candi Borobudur meliputi warna, porositas, daya serap air, kekerasan, dan temperatur.""","""Karakteristik fisik batu yang membentuk relief-relief di Candi Borobudur meliputi warna, porositas, daya serap air, kekerasan, dan temperatur. Batu candi yang berwarna gelap memiliki densitas lebih besar dibandingkan batu candi yang berwarna cerah karena kandungan ferro magnesium-nya lebih tinggi. Selain itu, batu candi yang berwarna gelap mampu menyerap panas lebih besar dibandingkan batu candi yang berwarna cerah. Selain itu, terdapat perbedaan dalam porositas, daya serap air, kekerasan, dan temperatur antara batu-batu yang membentuk relief-relief di Candi Borobudur.""",single,Budaya
61,"""Bagaimana elemen-elemen profan seperti pariwisata terintegrasi dalam konteks Candi Borobudur?""","""Elemen-elemen profan seperti pariwisata terintegrasi dalam konteks Candi Borobudur melalui pendekatan strukturalisme Levi-Strauss yang menggambarkan dualisme fungsi candi sebagai tempat praktik keagamaan sekaligus objek pariwisata. Dalam konteks ini, lembaga pariwisata memandang Borobudur sebagai komoditas pariwisata yang dapat dikelola dan menghasilkan uang. Mereka memanfaatkan keunikan bentuk Borobudur sebagai simbol Indonesia untuk mengadakan berbagai kegiatan pariwisata seperti pameran fashion, festival, lomba, dan konser musik. Dengan demikian, elemen-elemen profan pariwisata terintegrasi dalam konteks Candi Borobudur melalui pemanfaatan nilai sakral candi yang bergeser menjadi nilai profan sebagai sistem tanda materialisme dalam industri pariwisata.""","""Elemen-elemen profan seperti pariwisata terintegrasi dalam konteks Candi Borobudur melalui pendekatan strukturalisme Levi-Strauss yang menggambarkan dualisme fungsi candi sebagai tempat praktik keagamaan sekaligus objek pariwisata. Dalam konteks ini, lembaga pariwisata memandang Borobudur sebagai komoditas pariwisata yang dapat dikelola dan menghasilkan uang. Mereka memanfaatkan keunikan bentuk Borobudur sebagai simbol Indonesia untuk mengadakan berbagai kegiatan pariwisata seperti pameran fashion, festival, lomba, dan konser musik. Dengan demikian, elemen-elemen profan pariwisata terintegrasi dalam konteks Candi Borobudur melalui pemanfaatan nilai sakral candi yang bergeser menjadi nilai profan sebagai sistem tanda materialisme dalam industri pariwisata.""",single,Budaya
62,"""Apa peran elemen-elemen arsitektur di lantai teras Candi Borobudur dalam membangun suasana spiritual?""","""Elemen-elemen arsitektur di lantai teras Candi Borobudur memainkan peran penting dalam membangun suasana spiritual melalui simbolisme, desain, dan atmosfer yang diciptakan. Dengan struktur bertingkat yang mengarah ke puncak candi, elemen-elemen arsitektur tersebut menciptakan perasaan ketinggian dan perjalanan spiritual bagi para pengunjung.""","""Elemen-elemen arsitektur di lantai teras Candi Borobudur memainkan peran penting dalam membangun suasana spiritual melalui simbolisme, desain, dan atmosfer yang diciptakan. Dengan struktur bertingkat yang mengarah ke puncak candi, elemen-elemen arsitektur tersebut menciptakan perasaan ketinggian dan perjalanan spiritual bagi para pengunjung. Selain itu, relief-relief yang menghiasi dinding lantai teras juga berperan dalam membangun suasana spiritual dengan menggambarkan ajaran-ajaran Buddha, kisah-kisah spiritual, dan simbol-simbol yang memicu refleksi dan kontemplasi. Dengan demikian, elemen-elemen arsitektur tersebut membantu menciptakan lingkungan yang mendukung praktik spiritual, meditasi, dan refleksi bagi para pengunjung.""",single,Budaya
63,"""Mengapa Candi Borobudur memiliki bentuk stupa di puncaknya, dan bagaimana hal ini mencerminkan simbolisme?""","""Candi Borobudur memiliki bentuk stupa di puncaknya karena stupa merupakan simbol penting dalam ajaran Buddhisme. Stupa di puncak Candi Borobudur disimbolkan sebagai bagian tertinggi dari candi, yang merupakan stupa induk, atau stupa terbesar yang ada di puncak candi.""","""Candi Borobudur memiliki bentuk stupa di puncaknya karena stupa merupakan simbol penting dalam ajaran Buddhisme. Stupa di puncak Candi Borobudur disimbolkan sebagai bagian tertinggi dari candi, yang merupakan stupa induk, atau stupa terbesar yang ada di puncak candi.
Dalam ajaran Buddhisme, stupa memiliki makna simbolis yang mendalam. Stupa melambangkan tubuh, pikiran, dan ajaran Buddha. Bagian atas stupa yang mempunyai bentuk kubus (disebut dengan harmika) yang ada di antara kubah dan puncak kerucut stupa mempunyai makna simbolis kepala Buddha. Bagian bawah stupa mempunyai makna simbolis kaki Buddha, sedangkan bagian kubahnya mempunyai makna simbolis tubuh Buddha.
Stupa juga merupakan simbol dari Mandala, yang melambangkan alam semesta raya dan tahapan akhir dari perjalanan spiritual seorang Bodhisattva menuju kesempurnaan tertinggi dan menjadi seorang Buddha. Dengan demikian, keberadaan stupa di puncak Candi Borobudur mencerminkan simbolisme yang dalam terkait dengan ajaran dan praktik spiritual dalam Buddhisme.""",single,Budaya
64,"""Bagaimana cara para arsitek zaman dahulu mengatasi tantangan teknis yang mungkin timbul dari penggunaan batu andesit?""","""Mereka memahami bahwa batu andesit rentan terhadap pemuaian dan pengerutan yang berbeda antara mineral-mineral penyusunnya dengan endapan garam.""","""Para arsitek zaman dahulu mengatasi tantangan teknis yang mungkin timbul dari penggunaan batu andesit dengan memperhatikan karakteristik batuan tersebut. Mereka memahami bahwa batu andesit rentan terhadap pemuaian dan pengerutan yang berbeda antara mineral-mineral penyusunnya dengan endapan garam. Oleh karena itu, mereka mungkin mengambil langkah-langkah teknis seperti memilih batuan dengan karakteristik yang sesuai, menerapkan teknik konstruksi yang tepat, dan mungkin juga menggunakan perlindungan tambahan untuk mengurangi dampak pemuaian dan pengerutan pada batu andesit.""",single,Budaya
65,"""Bagaimana elemen-elemen lantai teras Candi Borobudur menggambarkan siklus kehidupan dan kematian?""","""Misalnya, representasi binatang, simbol-simbol geometris, dan relief-relief di lantai teras Candi Borobudur dapat diartikan sebagai simbol dari siklus kehidupan, pemurnian spiritual, dan pencarian pencerahan. Selain itu, konsep pencapaian Bodhisattvabhumi yang terwakili dalam lantai teras juga mencerminkan perjalanan spiritual yang melibatkan siklus kelahiran, kehidupan, dan kematian.""","""Elemen-elemen lantai teras Candi Borobudur menggambarkan siklus kehidupan dan kematian melalui simbolisme yang terkait dengan ajaran Buddha. Dalam konteks ini, lantai teras Candi Borobudur mencerminkan konsep kosmologi dan siklus kehidupan yang tercermin dalam ajaran Buddha. Misalnya, representasi binatang, simbol-simbol geometris, dan relief-relief di lantai teras Candi Borobudur dapat diartikan sebagai simbol dari siklus kehidupan, pemurnian spiritual, dan pencarian pencerahan. Selain itu, konsep pencapaian Bodhisattvabhumi yang terwakili dalam lantai teras juga mencerminkan perjalanan spiritual yang melibatkan siklus kelahiran, kehidupan, dan kematian.""",single,Budaya
