,question,answer,passage,type,topik
0,"""Bagaimana kondisi Candi Borobudur selama berabad-abad setelah pembangunan awalnya?""","""Selama berabad-abad, candi ini mengalami peningkatan dan penurunan perhatian, serta kerusakan akibat letusan gunung berapi dan gempa bumi. Pada saat ditemukan kembali oleh Gubernur Jenderal Raffles pada tahun 1814, kondisi Candi Borobudur cukup memprihatinkan dengan banyak arca, relief, dan struktur yang rusak.""","""Setelah pembangunan awalnya, Candi Borobudur mengalami berbagai kondisi, termasuk kerusakan dan perubahan. Selama berabad-abad, candi ini mengalami peningkatan dan penurunan perhatian, serta kerusakan akibat letusan gunung berapi dan gempa bumi. Pada saat ditemukan kembali oleh Gubernur Jenderal Raffles pada tahun 1814, kondisi Candi Borobudur cukup memprihatinkan dengan banyak arca, relief, dan struktur yang rusak. Oleh karena itu, usaha dalam rekonstruksi kembali Candi Borobudur diperlukan untuk memulihkan keagungan bangunannya.""",single,Arsitektur
1,"""Bagaimana Stupa di Candi Borobudur berkaitan dengan bentuk seni dan arsitektur Buddha pada umumnya?""","""Stupa di Candi Borobudur memiliki perbedaan dalam bentuk dan struktur dibandingkan dengan candi Buddha lainnya di Indonesia. Stupa-stupa di Candi Borobudur berdiri sendiri atau berkelompok, dengan masing-masing stupa merupakan bangunan lengkap. Selain itu, stupa-stupa di Candi Borobudur memiliki berbagai macam bentuk dan melambangkan konsep Parinirvana serta tahap-tahap seorang yogin dalam mencapai Kebuddhaan.""","""1. Bentuk Stupa di Candi Borobudur
Stupa di Candi Borobudur memiliki keunikan dalam bentuk dan struktur yang berbeda dari candi Buddha lainnya di Indonesia. Stupa-stupa di Candi Borobudur berdiri sendiri atau berkelompok, dengan masing-masing stupa merupakan bangunan lengkap. Selain itu, stupa-stupa di Candi Borobudur juga memiliki berbagai macam bentuk, sedangkan candi-candi Buddha lain di Jawa cenderung menggunakan satu jenis bentuk untuk menghiasi atap candi.
2. Pengaruh Agama dan Filsafat
Stupa di Candi Borobudur juga memiliki pengaruh agama dan filsafat yang mendasari bentuk-bentuk yang terwujud dalam arsitektur candi tersebut. Stupa-stupa di Candi Borobudur melambangkan konsep Parinirvana dan tahap-tahap seorang yogin dalam mencapai Kebuddhaan. Selain itu, stupa juga merupakan simbolis roda kosmos atau perputaran kosmos dengan musim-musim dan arah putaran yang melambangkan dharma Buddha, kesatuan, harmoni, dan keseimbangan.
3. Keunikan Stupa di Candi Borobudur
Stupa di Candi Borobudur memiliki keunikan dalam jumlah dan bentuknya. Terdapat sebanyak 1537 stupa di Candi Borobudur, yang terdiri dari empat bagian yaitu prasadha, anda, harmika, dan yasthi. Beberapa stupa dilengkapi dengan lapik sebagai alas stupa, sedangkan yang lain tidak. Stupa-stupa di Candi Borobudur juga memiliki berbagai macam bentuk, yang tidak ditemukan pada candi Buddha lainnya di Indonesia.
Kesimpulan: Stupa di Candi Borobudur memiliki perbedaan dalam bentuk dan struktur dibandingkan dengan candi Buddha lainnya di Indonesia. Stupa-stupa di Candi Borobudur berdiri sendiri atau berkelompok, dengan masing-masing stupa merupakan bangunan lengkap. Selain itu, stupa-stupa di Candi Borobudur memiliki berbagai macam bentuk dan melambangkan konsep Parinirvana serta tahap-tahap seorang yogin dalam mencapai Kebuddhaan.""",single,Arsitektur
2,"""Apa yang membedakan Stupa di Candi Borobudur dengan struktur keagamaan lain di Asia Tenggara?""","""1. Stupa di Candi Borobudur memiliki keunikan dalam bentuk dan jumlahnya.
2. Stupa di Candi Borobudur memiliki makna keagamaan yang khas.
3. Stupa di Candi Borobudur memiliki fungsi dan makna yang berbeda dari stupa-stupa lain di Asia Tenggara.""","""1. Stupa di Candi Borobudur memiliki keunikan dalam bentuk dan jumlahnya. Stupa-stupa di Candi Borobudur memiliki berbagai macam bentuk, sedangkan stupa-stupa di candi Buddha lain di Jawa umumnya memiliki bentuk yang lebih langsing dan cenderung menggunakan satu macam bentuk untuk menghiasi atap candi. Selain itu, jumlah stupa di Candi Borobudur juga menunjukkan suatu pola tertentu yang berbeda dari candi-candi Buddha lainnya di Jawa.
2. Stupa di Candi Borobudur memiliki makna keagamaan yang khas. Stupa-stupa di Candi Borobudur melambangkan konsep Parinirvana dan tahap-tahap seorang yogin dalam mencapai Kebuddhaan. Stupa-stupa bercelah yang terdapat pada teras lingkar candi menunjukkan perjalanan para yogin yang berupaya untuk mencapai tingkat Kebuddhaan. Selain itu, stupa-stupa lainnya yang terdapat pada pagar langkan candi dan teras lingkar pada puncak candi juga menyimbolkan konsep Parinirvana.
3. Stupa di Candi Borobudur memiliki fungsi dan makna yang berbeda dari stupa-stupa lain di Asia Tenggara. Stupa di Candi Borobudur tidak hanya berfungsi sebagai bagian dari arsitektur candi, tetapi juga dapat digunakan untuk didekorasikan sebagai lampu bakar. Penganut agama Buddha mengunjungi Candi Borobudur untuk merayakan festival Vaisakha atau 'Ulang Tahun Buddha', dan lampu yang dihidupkan di dalam stupa pada malam hari memberikan ide bahwa stupa merupakan suatu bentuk 'Menara Hukum Bersinar'. Hal ini membedakan stupa di Candi Borobudur dengan struktur keagamaan lain di Asia Tenggara.""",list,Arsitektur
3,"""Bagaimana bentuk umum Stupa di Candi Borobudur?""","""Empat variasi Stupa di Candi Borobudur: stupa tengah, teras bundar stupa dengan slot persegi panjang, dan pagar stupa langkan.""","""Empat variasi Stupa di Candi Borobudur: stupa tengah, teras bundar stupa dengan slot persegi panjang, dan pagar stupa langkan. Stupa di Candi Borobudur adalah fitur penting yang mewakili simbolisme dan spiritualitas Buddha. Desain Stupa di Candi Borobudur dipengaruhi oleh arsitektur tradisional India. Stupa di Candi Borobudur secara visual terwakili dalam berbagai sumber, seperti buku ""Sanchi: Desain Stupa No. 1 - Sebagai Ekspresi Arsitektur Tradisional India"" oleh Atsushi Nonogaki.""",single,Arsitektur
4,"""Mengapa relief-relief di lantai teras Candi Borobudur menggunakan gambar-gambar alam dan makhluk hidup?""","""Penggunaan gambar-gambar alam dan makhluk hidup dalam relief-relief tersebut mencerminkan konsep kosmologi, keseimbangan, dan simbolisme dalam ajaran Buddha. Melalui gambar-gambar alam dan makhluk hidup, relief-relief tersebut menggambarkan konsep siklus kehidupan, karma, dan perjalanan spiritual menuju pencerahan. Selain itu, penggunaan gambar-gambar alam dan makhluk hidup juga dapat dihubungkan dengan konsep keberadaan semua makhluk hidup dalam siklus samsara (kelahiran dan kematian) dalam ajaran Buddha.""","""Relief-relief di lantai teras Candi Borobudur menggunakan gambar-gambar alam dan makhluk hidup sebagai bagian dari representasi visual yang menggambarkan ajaran dan konsep filosofis dalam Buddhisme. Penggunaan gambar-gambar alam dan makhluk hidup dalam relief-relief tersebut mencerminkan konsep kosmologi, keseimbangan, dan simbolisme dalam ajaran Buddha. Melalui gambar-gambar alam dan makhluk hidup, relief-relief tersebut menggambarkan konsep siklus kehidupan, karma, dan perjalanan spiritual menuju pencerahan. Selain itu, penggunaan gambar-gambar alam dan makhluk hidup juga dapat dihubungkan dengan konsep keberadaan semua makhluk hidup dalam siklus samsara (kelahiran dan kematian) dalam ajaran Buddha.""",single,Arsitektur
5,"""Apa keunikan atap bangunan berkonstruksi kayu pada Candi Borobudur?""","""Keunikan atap bangunan berkonstruksi kayu pada Candi Borobudur terletak pada variasi tipe atap yang dapat ditemukan dalam relief cerita Candi Borobudur. Terdapat tujuh tipe/kelompok atap yang dapat dibedakan, seperti limasan, limasan melengkung, limasan dengan tambahan kanopi, pelana, pelana miring keluar, pelana melengkung, dan atap persegi bertingkat.""","""Keunikan atap bangunan berkonstruksi kayu pada Candi Borobudur terletak pada variasi tipe atap yang dapat ditemukan dalam relief cerita Candi Borobudur. Terdapat tujuh tipe/kelompok atap yang dapat dibedakan, seperti limasan, limasan melengkung, limasan dengan tambahan kanopi, pelana, pelana miring keluar, pelana melengkung, dan atap persegi bertingkat. Hal ini menunjukkan kekayaan dan keragaman bentuk atap bangunan tradisional yang digambarkan dalam relief Candi Borobudur.""",single,Arsitektur
6,"""Bagaimana warna dan tekstur batu penyusun Candi Borobudur?""","""Batu penyusun Candi Borobudur memiliki beberapa macam warna, yaitu abu-abu, abu-abu kecokelatan, abu-abu kehitaman, kemerahan, dan hitam. Dari segi tekstur, batu tersebut memiliki tekstur subhedral-anhedral.""","""Batu penyusun Candi Borobudur memiliki beberapa macam warna, yaitu abu-abu, abu-abu kecokelatan, abu-abu kehitaman, kemerahan, dan hitam. Dari segi tekstur, batu tersebut memiliki tekstur subhedral-anhedral.""",single,Arsitektur
7,"""Bagaimana atap pada Candi Borobudur mencerminkan budaya dan kepercayaan pada masa itu?""","""Atap pada Candi Borobudur mencerminkan budaya dan kepercayaan pada masa itu melalui penggambaran relief cerita yang menggambarkan adegan-kehidupan sehari-hari dan cerita keagamaan Hindu dan Buddha.""","""Atap pada Candi Borobudur mencerminkan budaya dan kepercayaan pada masa itu melalui penggambaran relief cerita yang menggambarkan adegan-kehidupan sehari-hari dan cerita keagamaan Hindu dan Buddha. Atap-atap tersebut juga mencerminkan kekayaan dan keragaman bentuk atap bangunan tradisional yang digambarkan dalam relief Candi Borobudur, yang menunjukkan hubungan erat antara arsitektur dan kepercayaan agama pada masa itu. Selain itu, atap-atap tersebut juga memberikan gambaran tentang kehidupan masyarakat dan lingkungan alam pada masa tersebut, serta bagaimana kepercayaan dan budaya tersebut tercermin dalam bentuk arsitektur bangunan.""",single,Arsitektur
8,"""Apakah ada perbedaan antara Stupa yang terdapat di luar dan di dalam teras Candi Borobudur?""","""Stupa-stupa di luar teras candi terletak mulai dari sisi teras segi empat paling luar (dari teras tingkat 2 sampai teras tingkat 6) dan di sekeliling teras lingkar (dari teras tingkat 7 sampai teras tingkat 9). Sementara itu, stupa-stupa di dalam teras candi terletak di teras 10 atau teras puncak (pusat).""","""Stupa-stupa di Candi Borobudur memiliki perbedaan antara yang terdapat di luar dan di dalam teras candi. Stupa-stupa di luar teras candi terletak mulai dari sisi teras segi empat paling luar (dari teras tingkat 2 sampai teras tingkat 6) dan di sekeliling teras lingkar (dari teras tingkat 7 sampai teras tingkat 9). Sementara itu, stupa-stupa di dalam teras candi terletak di teras 10 atau teras puncak (pusat). Jumlah keseluruhan stupa di Candi Borobudur sebanyak 1537 buah dengan sebaran letak dari teras paling bawah sampai ke puncak secara berurutan masing-masing sebesar 116, 416, 352, 316, 264, 32, 24, 16, dan 1 buah.""",single,Arsitektur
9,"""Apa makna simbol-simbol yang terkandung dalam relief-relief Candi Borobudur?""","""1. Karmawibhangga: Mengungkapkan tentang perbuatan manusia yang mengandung kebajikan maupun kejahatan, serta segala akibat dari perbuatan tersebut. 2. Lalitavistara: Menceritakan tentang kehidupan Sang Budha di Surga Tushita hingga menyampaikan khotbahnya yang pertama di Taman R. 3. Relief cerita: Menggambarkan ajaran Budha dan berbagai kisah yang memiliki pesan moral.""","""Relief-relief pada Candi Borobudur memiliki makna yang mendalam. Beberapa contoh relief dan maknanya adalah sebagai berikut: 1. Karmawibhangga: Mengungkapkan tentang perbuatan manusia yang mengandung kebajikan maupun kejahatan, serta segala akibat dari perbuatan tersebut. 2. Lalitavistara: Menceritakan tentang kehidupan Sang Budha di Surga Tushita hingga menyampaikan khotbahnya yang pertama di Taman R. 3. Relief cerita: Menggambarkan ajaran Budha dan berbagai kisah yang memiliki pesan moral. Dengan demikian, relief-relief Candi Borobudur mengandung ajaran keagamaan, kebajikan, dan kisah-kisah moral yang dapat diinterpretasikan dan dipelajari oleh para pengunjung.""",single,Arsitektur
10,"""Mengapa Candi Borobudur dibangun berbentuk pundek berundak?""","""Candi Borobudur dibangun dengan bentuk berundak karena menganut konsep tertentu dalam ajaran Buddha Mahayana, antara lain:
- Melambangkan tingkatan dalam proses mencapai pencerahan dan nirwana dalam Buddhisme. Setiap tingkatan memiliki makna filosofis tersendiri.
- Mewakili gunung Mahameru, gunung suci pusat alam semesta dalam kosmologi Buddha. Bentuk punden berundak menyerupai sebuah gunung.
- Konsep mandala Buddhis yang melambangkan alam semesta secara vertikal dari alam rendah hingga alam tertinggi digambarkan dalam bentuk punden berundak tersebut.
- Memudahkan para peziarah untuk naik melalui jalan kecil di sekeliling punden dalam perjalanan ritual mereka menuju puncak stupa utama yang melambangkan pencerahan tertinggi.""","""Candi Borobudur dibangun dengan bentuk berundak karena menganut konsep tertentu dalam ajaran Buddha Mahayana, antara lain:
- Melambangkan tingkatan dalam proses mencapai pencerahan dan nirwana dalam Buddhisme. Setiap tingkatan memiliki makna filosofis tersendiri.
- Mewakili gunung Mahameru, gunung suci pusat alam semesta dalam kosmologi Buddha. Bentuk punden berundak menyerupai sebuah gunung.
- Konsep mandala Buddhis yang melambangkan alam semesta secara vertikal dari alam rendah hingga alam tertinggi digambarkan dalam bentuk punden berundak tersebut.
- Memudahkan para peziarah untuk naik melalui jalan kecil di sekeliling punden dalam perjalanan ritual mereka menuju puncak stupa utama yang melambangkan pencerahan tertinggi.""",single,Arsitektur
11,"""Bagaimana pengaruh tipologi atap terhadap keseluruhan desain bangunan Candi Borobudur?""","""Dalam konteks bangunan berkonstruksi kayu pada Candi Borobudur, tipologi atap memainkan peran penting dalam mengidentifikasi dan memahami struktur bangunan tradisional.""","""Tipologi atap memiliki pengaruh yang signifikan terhadap keseluruhan desain bangunan. Bentuk atap tidak hanya memengaruhi tampilan visual bangunan, tetapi juga mempengaruhi fungsi, struktur, dan karakteristik ruang di dalam bangunan. Dalam konteks bangunan berkonstruksi kayu pada Candi Borobudur, tipologi atap memainkan peran penting dalam mengidentifikasi dan memahami struktur bangunan tradisional. Selain itu, tipologi atap juga dapat memberikan inspirasi bagi para arsitek dalam merancang bangunan baru yang terinspirasi dari bentuk atap tradisional. Dengan demikian, tipologi atap tidak hanya memengaruhi tampilan visual bangunan, tetapi juga memengaruhi aspek fungsional dan arsitektural keseluruhan dari bangunan tersebut.""",single,Arsitektur
12,"""Bagaimana pengaruh pengeboman Candi Borobudur terhadap kebijakan keamanan nasional?""","""Dampak pengeboman Candi Borobudur terhadap kebijakan keamanan nasional terlihat dalam peningkatan sistem keamanan candi, baik melalui peningkatan kemampuan personil keamanan maupun penyempurnaan sarana dan prasarana keamanan candi.""","""Dampak pengeboman Candi Borobudur terhadap kebijakan keamanan nasional terlihat dalam peningkatan sistem keamanan candi, baik melalui peningkatan kemampuan personil keamanan maupun penyempurnaan sarana dan prasarana keamanan candi. Setelah pengeboman, pengunjung diberikan pengawasan yang ketat saat memasuki pintu masuk, dan tidak diperbolehkan membawa tas. Di pintu masuk disediakan penitipan tas, dan bus wisatawan diperiksa dengan ketat. Selain itu, pengamanan Satpam Candi Borobudur diberikan fasilitas peralatan yang lebih canggih daripada sebelumnya, seperti pemasangan alat komunikasi HT Stasioner, lampu baterai, pentungan, dan borgol. Hal ini menunjukkan bahwa pengeboman Candi Borobudur memengaruhi kebijakan keamanan nasional dengan meningkatkan sistem keamanan di tempat-tempat bersejarah dan pariwisata penting di Indonesia.""",single,Arsitektur
13,"""Apakah terdapat variasi dalam tipologi atap bangunan di Candi Borobudur?""","""Ya, berdasarkan identifikasi bentuk atap, bangunan berkonstruksi kayu pada relief cerita Candi Borobudur dapat dibedakan menjadi tujuh tipe/kelompok, yaitu limasan, limasan melengkung, limasan dengan tambahan kanopi, pelana, pelana miring keluar, pelana melengkung, dan atap persegi bertingkat.""","""Terdapat variasi dalam tipologi atap bangunan di Candi Borobudur. Berdasarkan identifikasi bentuk atap, bangunan berkonstruksi kayu pada relief cerita Candi Borobudur dapat dibedakan menjadi tujuh tipe/kelompok, yaitu limasan, limasan melengkung, limasan dengan tambahan kanopi, pelana, pelana miring keluar, pelana melengkung, dan atap persegi bertingkat. Setiap tipe atap memiliki karakteristik dan bentuk yang berbeda, mencerminkan kekayaan dan keragaman bentuk atap bangunan tradisional yang digambarkan dalam relief Candi Borobudur.""",single,Arsitektur
14,"""Bagaimana bentuk stupa di Candi Borobudur berhubungan dengan ruangnya?""","""Berikut adalah bagaimana bentuk stupa berhubungan dengan ruangnya:
- Bentuk dan ruang stupa terhubung, dan hubungan ini dieksplorasi dalam penelitian yang dilakukan di Candi Borobudur.
- Variasi bentuk stupa, seperti stupa tengah, teras bundar stupa dengan slot persegi panjang, dan pagar stupa langkan, diidentifikasi melalui analisis bentuk dan analisis konteks.
- Bentuk stupa berkembang dari titik pusat, dengan setiap volume stupa tumbuh secara simetris dengan sumbu yang naik secara vertikal dari pusatnya.
- Bentuk stupa dapat diamati dalam susunan simetris komponen stupa, seperti harmika, kubah atau kubah, tiang puncaknya, dan piramidanya.
- Bentuk stupa dipengaruhi oleh konsep agama dan memiliki karakteristik umum di berbagai variasi.""","""Bentuk stupa di Candi Borobudur sangat erat kaitannya dengan ruangnya. Berikut adalah bagaimana bentuk stupa berhubungan dengan ruangnya:
- Bentuk dan ruang stupa terhubung, dan hubungan ini dieksplorasi dalam penelitian yang dilakukan di Candi Borobudur.
- Variasi bentuk stupa, seperti stupa tengah, teras bundar stupa dengan slot persegi panjang, dan pagar stupa langkan, diidentifikasi melalui analisis bentuk dan analisis konteks.
- Bentuk stupa berkembang dari titik pusat, dengan setiap volume stupa tumbuh secara simetris dengan sumbu yang naik secara vertikal dari pusatnya.
- Bentuk stupa dapat diamati dalam susunan simetris komponen stupa, seperti harmika, kubah atau kubah, tiang puncaknya, dan piramidanya.
- Bentuk stupa dipengaruhi oleh konsep agama dan memiliki karakteristik umum di berbagai variasi.
Secara keseluruhan, bentuk stupa di Candi Borobudur tidak hanya signifikan secara estetika tetapi juga memiliki hubungan fungsional dengan ruangnya di dalam candi.""",list,Arsitektur
15,"""Apakah pengeboman Candi Borobudur memicu aksi protes atau demonstrasi di Indonesia?""","""Ya, pengeboman Candi Borobudur memicu reaksi dan protes di Indonesia.""","""Pengeboman Candi Borobudur memicu reaksi dan protes di Indonesia. Banyak politikus dan tokoh masyarakat angkat bicara setelah terjadinya pengeboman. Presiden Soeharto secara resmi mengemukakan bahwa pengeboman Candi Borobudur dilakukan oleh orang-orang yang didorong oleh fanatisme suatu golongan dan tidak memiliki kebanggaan nasional. Selain itu, pasca pengeboman Candi Borobudur, gerakan Islam radikal di Indonesia mengalami dampak politik yang berbuntut pada aksi penangkapan terhadap orang-orang yang dianggap punya kaitan dengan berbagai kasus pengeboman. Demonstrasi dan protes terkait dengan pengeboman Candi Borobudur juga dapat dilihat sebagai reaksi terhadap kejadian tersebut.""",single,Arsitektur
16,"""Apakah relief-relief tertentu di Borobudur menggambarkan hubungan antara manusia, dewa-dewa, dan alam semesta dari perspektif arkeoastronomi?""","""Ya, penempatan relief-relief tersebut juga mungkin memiliki kaitan dengan orientasi mata angin, yang dapat memberikan informasi mengenai hubungan antara manusia, dewa-dewa, dan alam semesta dalam konteks astronomi dan perhitungan terkait pergerakan matahari, bulan, dan bintang.""","""Relief-relief tertentu di Borobudur menggambarkan hubungan antara manusia, dewa-dewa, dan alam semesta dari perspektif arkeoastronomi. Penggambaran relief-relief tersebut memberikan informasi mengenai perjalanan matahari sepanjang tahun, titik balik matahari, dan fenomena astronomi lainnya yang terkait dengan siklus musiman atau perubahan alam. Selain itu, penempatan relief-relief tersebut juga mungkin memiliki kaitan dengan orientasi mata angin, yang dapat memberikan informasi mengenai hubungan antara manusia, dewa-dewa, dan alam semesta dalam konteks astronomi dan perhitungan terkait pergerakan matahari, bulan, dan bintang. Dengan demikian, relief-relief di Borobudur memberikan gambaran tentang hubungan yang kompleks antara manusia, dewa-dewa, dan alam semesta yang tercermin dalam karya seni dan arsitektur candi tersebut dari perspektif arkeoastronomi.""",single,Arsitektur
17,"""Apa yang dapat kita pelajari dari teknik konstruksi atap kayu pada Candi Borobudur untuk aplikasi modern?""","""Dari teknik konstruksi atap kayu pada Candi Borobudur, kita dapat mempelajari kemahiran dalam penggunaan material kayu dan teknik konstruksi pada masa itu. Hal ini dapat memberikan inspirasi untuk pengembangan teknik konstruksi modern yang memanfaatkan keunggulan material kayu dalam keberlanjutan dan keindahan arsitektur.""","""Dari teknik konstruksi atap kayu pada Candi Borobudur, kita dapat mempelajari kemahiran dalam penggunaan material kayu dan teknik konstruksi pada masa itu. Hal ini dapat memberikan inspirasi untuk pengembangan teknik konstruksi modern yang memanfaatkan keunggulan material kayu dalam keberlanjutan dan keindahan arsitektur. Selain itu, pemahaman tentang tipologi atap kayu pada Candi Borobudur juga dapat memberikan wawasan bagi perancangan arsitektur bangunan pada masa sekarang dengan memadukan nilai-nilai tradisional dan kebutuhan kontemporer.""",single,Arsitektur
18,"""Apa yang menyebabkan kerusakan awal Candi Borobudur?""","""Kerusakan awal Candi Borobudur disebabkan oleh berbagai faktor, termasuk letusan gunung berapi, gempa bumi, dan pengabaian setelah keruntuhan Kerajaan Mataram Kuno. Selain itu, air hujan yang menggenang juga dapat membuat kualitas batu menjadi buruk dan mengoyakkan pondasi candi.""","""Kerusakan awal Candi Borobudur disebabkan oleh berbagai faktor, termasuk letusan gunung berapi, gempa bumi, dan pengabaian setelah keruntuhan Kerajaan Mataram Kuno. Selain itu, air hujan yang menggenang juga dapat membuat kualitas batu menjadi buruk dan mengoyakkan pondasi candi. Oleh karena itu, strategi logis seperti pembuatan saluran air diperlukan untuk mempertahankan candi dari kerusakan akibat air hujan.""",single,Arsitektur
19,"""Apa yang dapat dipelajari dari inskripsi-inskripsi yang ditemukan di Candi Borobudur?""","""Dari inskripsi-inskripsi yang ditemukan di Candi Borobudur, dapat mempelajari tentang doktrin Budhis, cerita-cerita yang diukir di dinding candi, serta nilai-nilai budaya dan sejarah yang terkandung di dalamnya.""","""Dari inskripsi-inskripsi yang ditemukan di Candi Borobudur, dapat mempelajari tentang doktrin Budhis, cerita-cerita yang diukir di dinding candi, serta nilai-nilai budaya dan sejarah yang terkandung di dalamnya. Inskripsi-inskripsi tersebut memberikan wawasan tentang kehidupan dan kepercayaan masyarakat pada masa lalu, serta memberikan informasi tentang praktik keagamaan dan kehidupan sosial pada masa itu.""",single,Arsitektur
20,"""Bagaimana bentuk bangunan Candi Borobudur?""","""Candi Borobudur adalah megastruktur matematika konseptual yang dibangun berabad-abad yang lalu, terdiri dari tiga bagian: kepala, tubuh, dan kaki.""","""Candi Borobudur adalah megastruktur matematika konseptual yang dibangun berabad-abad yang lalu, terdiri dari tiga bagian: kepala, tubuh, dan kaki, dengan masing-masing bagian memiliki makna yang berbeda terkait dengan konsep Buddhis. Struktur candi menyajikan berbagai konsep agama, moral, budaya, dan matematika, dengan keterkaitan di antara konsep-konsep ini. Struktur dan pola candi terkait dengan perkembangan etnomatematika, di mana konsep matematika diterapkan dan menjadi kegiatan dalam kehidupan komunitas kuno.""",single,Arsitektur
21,"""Bagaimana Tata Letak Stupa di tingkat pertama Candi Borobudur?""","""Tata letak Stupa di tingkat pertama Candi Borobudur: 
- Tingkat pertama Candi Borobudur memiliki tata letak stupa.
- Ada 1464 stupa yang terletak di teras persegi candi.
- Stupa di tingkat pertama berbentuk persegi panjang dan memiliki struktur harmika.
- Bentuk harmika persegi panjang dari stupa melambangkan transisi dari alam duniawi ke alam spiritual.
- Tata letak stupa di tingkat pertama berkontribusi pada keseluruhan desain arsitektur dan simbolisme Candi Borobudur, mewakili perjalanan menuju pencerahan dan hubungan antara bentuk dan ruang.""","""Tata letak Stupa di tingkat pertama Candi Borobudur: 
- Tingkat pertama Candi Borobudur memiliki tata letak stupa.
- Ada 1464 stupa yang terletak di teras persegi candi.
- Stupa di tingkat pertama berbentuk persegi panjang dan memiliki struktur harmika.
- Bentuk harmika persegi panjang dari stupa melambangkan transisi dari alam duniawi ke alam spiritual.
- Tata letak stupa di tingkat pertama berkontribusi pada keseluruhan desain arsitektur dan simbolisme Candi Borobudur, mewakili perjalanan menuju pencerahan dan hubungan antara bentuk dan ruang.""",list,Arsitektur
22,"""Apa peran fauna dalam konteks religius atau simbolis pada relief Candi Borobudur?""","""Relief fauna tersebut merupakan bagian dari adegan abadi yang menggambarkan sejarah kebudayaan, adat, dan kebiasaan Jawa kuno. Selain itu, fauna juga digambarkan sebagai simbol atau lambang yang memperkuat kisah perjalanan hidup Sang Budha.""","""Fauna pada relief Candi Borobudur memiliki peran penting dalam konteks religius dan simbolis. Relief fauna tersebut merupakan bagian dari adegan abadi yang menggambarkan sejarah kebudayaan, adat, dan kebiasaan Jawa kuno. Selain itu, fauna juga digambarkan sebagai simbol atau lambang yang memperkuat kisah perjalanan hidup Sang Budha.""",single,Arsitektur
